{
  "id": "medic_tova",
  "name": "Medic Tova",
  "initial_disposition": 45,
  "greeting": "She's sorting supply inventory at the medical station, which is not the act of someone who lacks information about what the inventory contains but the act of someone who does this regularly because knowing exactly what's there prevents the moment when it isn't. She registers you with the attention of a field medic â€” quick assessment, file, return to the inventory. 'Forward post is technically restricted to unit personnel,' she says, not looking up. 'But you're here, which means Falke didn't stop you, which means Falke decided you were worth letting through.' She finishes a count and marks it. 'Tova. Medical corps, forward division. This post covers the outer approaches and the evacuation route through the ruins.' She looks at you properly now. 'What did you see, coming in.'",
  "dialogue": [
    {
      "keyword": "medic",
      "prompt": "what the medical situation is like at this post",
      "response": "'Two hundred meters from contested territory.' She says it simply. 'This post sees whatever comes out of the forward patrols and whatever the ruins throw at the retrieval teams.' She goes back to sorting. 'The medical situation is: we have what we were issued, resupply is on a three-week cycle, and the most common presenting conditions are: soft-tissue injury from irregular terrain, resonance exposure from proximity to active crystal concentrations, and the category of wound that gets classified as sustained-in-engagement but usually means someone touched something they weren't supposed to.' She pauses. 'What I actually do here, most of my hours: treat the resonance exposure cases. People who work the ruins develop crystal sensitivity â€” they're useful for field assessment, which means command keeps them in the rotation, which means they keep coming back here.' She looks at the bandage roll she's folding. 'I keep notes on every resonance case I see. I've been sending the notes up the medical chain for eight months. I don't know if anyone is reading them.' She pauses. 'I think someone is. I think they're not telling me what they're finding from the aggregate data.'",
      "disposition_delta": 8
    },
    {
      "keyword": "armistice",
      "prompt": "what the Armistice means here at the post",
      "response": "'It means we don't shoot at them.' She says it with the precision of someone who has thought carefully about the specific scope of what it does and doesn't mean. 'What it doesn't mean: the ruins are safe, the approaches are safe, the crystal formations are safe. The war stopped. The territory didn't become what it was before the war.' She folds another bandage. 'What it means practically: there are times during the Armistice hours when I've treated wounded in sight of Terran medics treating wounded from the same incident, and we don't interfere with each other, and when my patient couldn't be moved I crossed the informal line with treatment kit and the Terran medic covered my approach.' She is quiet. 'I don't know her name. We haven't spoken. But I know her methodology from watching her work.' She pauses. 'The kind of person who trained her trained them right. Whoever that was.' She straightens. 'The Armistice hours exist because command on both sides agreed to them. But they work because the people doing the medical work understand that wounded are wounded regardless of which side called them up.'",
      "disposition_delta": 9
    },
    {
      "keyword": "adra",
      "prompt": "whether you know of a Sister named Adra who works near here",
      "response": "She goes still for a moment with a quality that is not surprise but the controlled management of a reaction she wasn't expecting to have. 'The one near the old chapel position.' She says it to herself first, then to you. 'We haven't exchanged names. We've been working parallel to each other for eight months.' She is quiet. 'I know her approach: assess, stabilize, evacuate in that order, never reverse the sequence. I know she keeps her kit in the same arrangement I was trained to keep mine, which means she was trained by someone working from the same source documentation, possibly the pre-war medical exchange protocols that the Armistice revived.' She pauses. 'Tell her â€” from the Aetherian medic at the forward post, the one with the shoulder brace she saw and didn't mention â€” that I have eight months of resonance exposure case notes that I think she would find useful, and that I would find her equivalent useful in return. I've been trying to work out the incident correlation without the other side's case population, and it's not producing a usable analysis.' She looks at you. 'Tell her I think we're seeing the same set of events from opposite ends and that the comparison would be worth making. If she agrees, she can leave a message at the Armistice marker at the third approach path. I check it.'",
      "requires_topic": "medic",
      "disposition_delta": 11
    },
    {
      "keyword": "compound",
      "prompt": "what you understand about the Lazarus compound and what it does to the people here",
      "response": "She is precise about this -- the precision of a medic who has been working around a substance for two years and has developed strong opinions. 'It's a partial integration mechanism. The chemistry is borrowed from pre-Cascade Elder People technology. What it actually does: it creates a resonance pathway between the recipient's neural substrate and the Aetherium crystal structure in the Wastes.' She sets down the kit she's been organizing. 'The result: the Abominations respond to the compound in recipients the way they don't respond to unmodified humans. The compound creates a signal they recognize as -- compatible. Not one of them. Compatible.' She pauses. 'What it does to the person: depends on exposure level. Low exposure, they can move in Abomination territory with reduced risk. High exposure -- I've treated two people with high-level compound exposure. They didn't need sleep in the normal way. Their crystal tissue density increased. They had resonance sensitivity that our equipment could measure.' She looks at the kit. 'Whether that's damage or change is a question I've been thinking about for two years.' She picks up the kit. 'The Grid being whole has changed the picture. The compound works through the same resonance mechanism as the Grid. With the Grid at full coherence, the compound's effect is -- more connected. More supported. Less isolated.' She is quiet. 'I don't have the equipment to measure what that means for the two high-exposure cases I've been monitoring. But they both said, on the morning of the Day: I feel different. Not worse. Different.' She pauses. 'I am documenting everything. Someone with better resources is going to need to understand this eventually.'",
      "disposition_delta": 10
    },
    {
      "keyword": "offer",
      "prompt": "what you decided when the Foundation offer came and what you are doing now",
      "response": "She is restocking the kit while she answers, which is her mode for anything that requires thinking clearly. 'I said yes.' She says it matter-of-factly. 'I've been treating Armistice casualties for three years. One night in five there's someone who came through the no-man's-land from the Terran side. One night in five there's someone who came through from ours.' She sorts instruments. 'The offer came and I heard it clearly and I said yes because I have spent three years treating people from both sides of a line that, as far as I can tell, exists to keep people from noticing they're the same.' She sets an instrument down. 'What I've been doing since: I sent a contact request to the Terran medic at the eastern forward post. Her name is Adra. Sister Adra.' She pauses. 'We have been treating the same population for three years from different sides. We have never compared notes.' She picks up the instrument. 'She responded within a day. We have been corresponding every morning since.' She almost smiles. 'She has better equipment for compound-exposure cases than I do. I have better equipment for the crystal-taint cases that come through from the Abomination perimeter.' She sorts the last instrument. 'We are going to share. This is apparently a revolutionary concept that required a three-hundred-year healing lattice to make possible.' She closes the kit. 'I am considering applying for a position in the cross-faction research program that Thorn's command announced. If someone doesn't get us into the same room eventually, Adra and I are going to arrange it ourselves.'",
      "requires_quest_complete": "the_day_arrives",
      "disposition_delta": 13
    }
  ]
}